{
  "id": 13,
  "canonical_id": "beelzebub/ch13",
  "urn": "urn:beelzebub:ch13",
  "title": "Why in Man’s Reason Fantasy May Be Perceived as Reality",
  "title_raw": "WHY IN MAN’S REASON FANTASY MAY BE PERCEIVED AS REALITY",
  "title_slug": "why-in-man-s-reason-fantasy-may-be-perceived-as-reality",
  "number": 13,
  "page_start": 103,
  "page_end": 105,
  "paragraphs": [
    {
      "anchor": "13.103",
      "chapter": 13,
      "page_start": 103,
      "page_end": 103,
      "text": "“ M y dear and kind Grandfather, be so kind as to explain to me, if only in a general way, why those beings there are such that they take the ‘ephemeral’ for the Real.”"
    },
    {
      "anchor": "13.103",
      "chapter": 13,
      "page_start": 103,
      "page_end": 103,
      "text": "To this question of his grandson, Beelzebub replied thus:"
    },
    {
      "anchor": "13.103",
      "chapter": 13,
      "page_start": 103,
      "page_end": 103,
      "text": "“It was only during later periods that the three-brained beings of the planet Earth began to have this particularity in their psyche, and just this particularity arose in them only because their predominant part, which was formed in them as in all three-brained beings, gradually allowed other parts of their total presences to perceive every new impression without what is called ‘being-Partkdolg-duty’ but just merely as, in general, such impressions are perceived by the separate independent localizations existing under the name of being-centers present in the three-brained beings, or, as I should say in their language, they believe everything anybody says, and not solely that which they themselves have been able to recognize by their own sane deliberation."
    },
    {
      "anchor": "13.103-4",
      "chapter": 13,
      "page_start": 103,
      "page_end": 104,
      "text": "“In general, any new understanding is crystallized in the presence of these strange beings only if Smith speaks of somebody or something in a certain way; and then if Brown says the same, the hearer is quite convinced it is just so and couldn’t possibly be otherwise. Thanks merely to this particularity of their psyche and to the fact that the said writer was much spoken about in the said manner, most of the beings there at the present time are quite convinced that he is indeed a very great psychologist and has an incomparable knowledge of the psyche of the beings of his planet."
    },
    {
      "anchor": "13.104",
      "chapter": 13,
      "page_start": 104,
      "page_end": 104,
      "text": "“But, as a matter of fact, when I was on that planet for the last time and, having heard of the said writer, once went myself especially to see him, on quite another matter, he was according to my understanding not only like all the other contemporary writers there, that is to say, extremely limited, and as our dear Mullah Nassr Eddin would say: ‘able to see no further than his nose,’ but as regards any knowledge of the real psyche of the beings of his planet in real conditions, he might safely even be called ‘totally illiterate.’"
    },
    {
      "anchor": "13.104",
      "chapter": 13,
      "page_start": 104,
      "page_end": 104,
      "text": "“I repeat that the story of this writer is a very characteristic example showing the extent to which, in the threebrained beings who have taken your fancy, particularly in the contemporary ones, the realization of ‘being-Partkdolgduty’ is absent, and how their own subjective being-convictions formed by their own logical deliberations are never, as in general it is proper to three-brained beings, crystallized in them, but only those are crystallized which depend exclusively only upon what others say about the given question."
    },
    {
      "anchor": "13.104",
      "chapter": 13,
      "page_start": 104,
      "page_end": 104,
      "text": "“It was only because they failed to realize ‘being-Partkdolg-duty,’ which realization alone enables a being to become aware of genuine reality, that they saw in the said writer some perfection or other which was not there at all."
    },
    {
      "anchor": "13.104",
      "chapter": 13,
      "page_start": 104,
      "page_end": 104,
      "text": "“This strange trait of their general psyche, namely, of being satisfied with just what Smith or Brown says, without trying to know more, became rooted in them already long ago, and now they no longer strive at all to know anything cognizable by their own active deliberations alone."
    },
    {
      "anchor": "13.104-5",
      "chapter": 13,
      "page_start": 104,
      "page_end": 105,
      "text": "“Concerning all this it must be said that neither the organ Kundabuffer which their ancestors had is to blame, nor its consequences which, owing to a mistake on the part of certain Sacred Individuals, were crystallized in their ancestors and later began to pass by heredity from generation to generation."
    },
    {
      "anchor": "13.105",
      "chapter": 13,
      "page_start": 105,
      "page_end": 105,
      "text": "“But they themselves were personally to blame for it, and just on account of the abnormal conditions of external ordinary being-existence which they themselves have gradually established and which have gradually formed in their common presence just what has now become their inner ‘Evil-God,’ called ‘Self-Calming.’"
    },
    {
      "anchor": "13.105",
      "chapter": 13,
      "page_start": 105,
      "page_end": 105,
      "text": "“But all this you yourself, later on, will well understand, when I shall have given you, as I have already promised, more information about that planet which has taken your fancy."
    },
    {
      "anchor": "13.105",
      "chapter": 13,
      "page_start": 105,
      "page_end": 105,
      "text": "“In any case, I strongly advise you to be very careful in the future in your references to the three-brained beings of that planet, not to offend them in any way; otherwise—as they also say there, ‘With what may the Devil not joke?’— they might find out about your insulting them and, to use another of their expressions, ‘lay you by the heels.’"
    },
    {
      "anchor": "13.105",
      "chapter": 13,
      "page_start": 105,
      "page_end": 105,
      "text": "“And in the present case there is no harm in recalling again one of the wise sentences of our dear Mullah Nassr Eddin, who says:"
    },
    {
      "anchor": "13.105",
      "chapter": 13,
      "page_start": 105,
      "page_end": 105,
      "text": "“‘’Struth! What might not happen in this world. A flea might swallow an elephant.’”"
    },
    {
      "anchor": "13.105",
      "chapter": 13,
      "page_start": 105,
      "page_end": 105,
      "text": "Beelzebub intended to say something more, but at that moment a ship’s servant entered and, approaching, handed him an “etherogram” in his name."
    },
    {
      "anchor": "13.105",
      "chapter": 13,
      "page_start": 105,
      "page_end": 105,
      "text": "When Beelzebub had finished listening to the contents of the said “etherogram” and the ship’s servant had gone, Hassein turned to Beelzebub again with the following words:"
    },
    {
      "anchor": "13.105",
      "chapter": 13,
      "page_start": 105,
      "page_end": 105,
      "text": "“Dear Grandfather, please go on talking about the three-centered beings arising and existing on that interesting planet called Earth.”"
    },
    {
      "anchor": "13.105",
      "chapter": 13,
      "page_start": 105,
      "page_end": 105,
      "text": "Beelzebub having looked at his grandson again with a special smile, and having made a very strange gesture with his head, continued to speak as follows:"
    }
  ],
  "source": "Beelzebubs_Tales.pdf",
  "source_sha256": "07a485ba109a1caf664083020ede051c6894099af7276a29bc8e9ada56d3d8bc"
}