{
  "id": 0,
  "canonical_id": "beelzebub/front-matter",
  "urn": "urn:beelzebub:front-matter",
  "title": "Friendly Advice",
  "title_raw": "FRIENDLY ADVICE",
  "title_slug": "friendly-advice",
  "number": 0,
  "page_start": 0,
  "page_end": 0,
  "kind": "front_matter",
  "paragraphs": [
    {
      "anchor": "fa.1",
      "chapter": 0,
      "page_start": 0,
      "page_end": 0,
      "text": "ALL AND EVERYTHING - FIRST SERIES: BEELZEBUB'S TALES TO HIS GRANDSON “AN IMPARTIAL CRITICISM OF THE LIFE OF MAN” OR BEELZEBUB'S TALES TO HIS GRANDSON G. I. GURDJIEFF HTTPS://GURDJIEFF.WORK FRIENDLY ADVICE Written impromptu by the author on delivering this book, already prepared for publication, to the printer."
    },
    {
      "anchor": "fa.2",
      "chapter": 0,
      "page_start": 0,
      "page_end": 0,
      "text": "ACCORDING TO the numerous deductions and conclusions made by me during experimental elucidations concerning the productivity of the perception by contemporary people of new impressions from what is heard and read, and also according to the thought of one of the sayings of popular wisdom I have just remembered, handed down to our days from very ancient times, which declares:"
    },
    {
      "anchor": "fa.3",
      "chapter": 0,
      "page_start": 0,
      "page_end": 0,
      "text": "“Any prayer may be heard by the Higher Powers and a corresponding answer obtained only if it is uttered thrice:"
    },
    {
      "anchor": "fa.4",
      "chapter": 0,
      "page_start": 0,
      "page_end": 0,
      "text": "Firstly—for the welfare or the peace of the souls of one’s parents."
    },
    {
      "anchor": "fa.5",
      "chapter": 0,
      "page_start": 0,
      "page_end": 0,
      "text": "Secondly—for the welfare of one’s neighbor."
    },
    {
      "anchor": "fa.6",
      "chapter": 0,
      "page_start": 0,
      "page_end": 0,
      "text": "And only thirdly—for oneself personally.”"
    },
    {
      "anchor": "fa.7",
      "chapter": 0,
      "page_start": 0,
      "page_end": 0,
      "text": "I find it necessary on the first page of this book, quite ready for publication, to give the following advice:"
    },
    {
      "anchor": "fa.8",
      "chapter": 0,
      "page_start": 0,
      "page_end": 0,
      "text": "“Read each of my written expositions thrice:"
    },
    {
      "anchor": "fa.9",
      "chapter": 0,
      "page_start": 0,
      "page_end": 0,
      "text": "Firstly—at least as you have already become mechanized to read all your contemporary books and newspapers."
    },
    {
      "anchor": "fa.10",
      "chapter": 0,
      "page_start": 0,
      "page_end": 0,
      "text": "Secondly—as if you were reading aloud to another person."
    },
    {
      "anchor": "fa.11",
      "chapter": 0,
      "page_start": 0,
      "page_end": 0,
      "text": "And only thirdly—try and fathom the gist of my writings.” 2Only then will you be able to count upon forming your own impartial judgment, proper to yourself alone, on my writings. And only then can my hope be actualized that according to your understanding you will obtain the specific benefit for yourself which I anticipate, and which I wish for you with all my being. AUTHOR"
    }
  ],
  "source": "Beelzebubs_Tales.pdf",
  "source_sha256": "07a485ba109a1caf664083020ede051c6894099af7276a29bc8e9ada56d3d8bc"
}