{
  "id": 11,
  "canonical_id": "beelzebub/ch11",
  "urn": "urn:beelzebub:ch11",
  "title": "A Piquant Trait of the Peculiar Psyche of Contemporary Man",
  "title_raw": "A PIQUANT TRAIT OF THE PECULIAR PSYCHE OF CONTEMPORARY MAN",
  "title_slug": "a-piquant-trait-of-the-peculiar-psyche-of-contemporary-man",
  "number": 11,
  "page_start": 94,
  "page_end": 97,
  "paragraphs": [
    {
      "anchor": "11.94",
      "chapter": 11,
      "page_start": 94,
      "page_end": 94,
      "text": "Now let us return to those three-brained beings arising on the planet Earth, who have interested you most of all and whom you have called ‘slugs.’"
    },
    {
      "anchor": "11.94",
      "chapter": 11,
      "page_start": 94,
      "page_end": 94,
      "text": "“I shall begin by saying how glad I am that you happen to be a long way from those three-centered beings whom you called by a word so ‘insulting to their dignity’ and that they are not likely ever to hear of it."
    },
    {
      "anchor": "11.94",
      "chapter": 11,
      "page_start": 94,
      "page_end": 94,
      "text": "“Do you know, you poor thing, you small boy not yet aware of himself, what they would do to you, particularly the contemporary beings there, if they should hear what you called them?"
    },
    {
      "anchor": "11.94",
      "chapter": 11,
      "page_start": 94,
      "page_end": 94,
      "text": "“What they would have done to you if you had been there and if they had got hold of you—I am seized with horror at the very mention of it."
    },
    {
      "anchor": "11.94",
      "chapter": 11,
      "page_start": 94,
      "page_end": 94,
      "text": "“At best they would have thrashed you so, that as our Mullah Nassr Eddin there says, ‘you wouldn’t have recovered your senses before the next crop of birches.’ A Piquant Trait of the Peculiar Psyche of Contemporary … | 111"
    },
    {
      "anchor": "11.94",
      "chapter": 11,
      "page_start": 94,
      "page_end": 94,
      "text": "“In any case, I advise you that, whenever you start anything new, you should always bless Fate and beseech her mercy, that she should always be on guard and prevent the beings of the planet Earth from ever suspecting that you, my beloved and only grandson, dared to call them ‘slugs.’"
    },
    {
      "anchor": "11.94",
      "chapter": 11,
      "page_start": 94,
      "page_end": 94,
      "text": "“You must know that during the time of my observations of them from the planet Mars and during the periods of my existence among them, I studied the psyche of these strange three-brained beings very thoroughly, and so I already know very well what they would do to anybody who dared to give them such a nickname."
    },
    {
      "anchor": "11.95",
      "chapter": 11,
      "page_start": 95,
      "page_end": 95,
      "text": "“To be sure, it was only in childish naïvete that you called them so; but the three-brained beings of that peculiar planet, especially the contemporary ones, do not discriminate such fine points."
    },
    {
      "anchor": "11.95",
      "chapter": 11,
      "page_start": 95,
      "page_end": 95,
      "text": "“Who called them, why, and in what circumstances—it’s all one. They have been called by a name they consider insulting—and that’s quite enough."
    },
    {
      "anchor": "11.95",
      "chapter": 11,
      "page_start": 95,
      "page_end": 95,
      "text": "“Discrimination in such matters is, according to the understanding of most of them, simply, as they express it, ‘pouring from the empty into the void.’"
    },
    {
      "anchor": "11.95",
      "chapter": 11,
      "page_start": 95,
      "page_end": 95,
      "text": "“Be that as it may, you were in any case extremely rash to call the three-brained beings breeding on the planet Earth by such an offensive name; first, because you have made me anxious for you, and secondly, because you have laid up for yourself a menace for the future."
    },
    {
      "anchor": "11.95",
      "chapter": 11,
      "page_start": 95,
      "page_end": 95,
      "text": "“The position is this: Though, as I have already said, you are a long way off, and they will be unable to get at you to punish you personally, yet nevertheless if they should somehow unexpectedly chance to learn even at twentieth hand how you insulted them, then you could at once be sure of their real ‘anathema,’ and the dimensions of this anathema would depend upon the interests with which they happened to be occupied at the given moment."
    },
    {
      "anchor": "11.95",
      "chapter": 11,
      "page_start": 95,
      "page_end": 95,
      "text": "“Perhaps it is worth while describing to you how the beings of the Earth would behave if they should happen to learn that you had so insulted them. This description may serve as a very good example for the elucidation of the strangeness of the psyche of these three-brained beings who interest you."
    },
    {
      "anchor": "11.95-6",
      "chapter": 11,
      "page_start": 95,
      "page_end": 96,
      "text": "“Provoked by such an incident as your thus insulting them, if everything was rather ‘dull’ with them at the given moment, owing to the absence of any other similar absurd interest, they would arrange somewhere in a previously chosen place, with previously invited people, all of course dressed in costumes specially designed for such occasions, what is called a ‘solemn council.’"
    },
    {
      "anchor": "11.96",
      "chapter": 11,
      "page_start": 96,
      "page_end": 96,
      "text": "“First of all, for this ‘solemn council’ of theirs, they would select from among themselves what is called a ‘president’ and only then would they proceed with their ‘trial.’"
    },
    {
      "anchor": "11.96",
      "chapter": 11,
      "page_start": 96,
      "page_end": 96,
      "text": "“To begin with, they would, as they say there, ‘pick you to pieces,’ and not only you, but your father, your grandfather, and perhaps even all the way back to Adam."
    },
    {
      "anchor": "11.96",
      "chapter": 11,
      "page_start": 96,
      "page_end": 96,
      "text": "“If they should then decide—of course, as always, by a majority of votes—that you are guilty, they would sentence you according to the indications of a code of laws collated on the basis of former similar ‘puppet plays’ by beings called ‘old fossils.’"
    },
    {
      "anchor": "11.96",
      "chapter": 11,
      "page_start": 96,
      "page_end": 96,
      "text": "“But if they should happen, by a ‘majority of votes’ to find nothing criminal in your action at all—though this A Piquant Trait of the Peculiar Psyche of Contemporary … | 113 very seldom occurs among them—then this whole ‘trial’ of theirs, set out on paper in detail and signed by the whole lot of them, would be dispatched—you would think into the wastepaper basket? Oh, no!—to appropriate specialists; in the given instances to what is called the ‘Hierarchy’ or ‘Holy Synod,’ where the same procedure would be repeated; only in this case you would be tried by ‘important’ beings there."
    },
    {
      "anchor": "11.96",
      "chapter": 11,
      "page_start": 96,
      "page_end": 96,
      "text": "“Only at the very end of this true ‘pouring from the empty into the void’ would they come to the main point, namely, that the accused is out of reach. “But it is just here that arises the principal danger to your person, namely, that when they are quite certain beyond all doubt that they cannot get hold of you, they will then unanimously decide nothing more nor less than, as I have already said, to ‘anathematize’ you."
    },
    {
      "anchor": "11.96",
      "chapter": 11,
      "page_start": 96,
      "page_end": 96,
      "text": "“And do you know what that is and how it is done? “No! “Then listen and shudder."
    },
    {
      "anchor": "11.97",
      "chapter": 11,
      "page_start": 97,
      "page_end": 97,
      "text": "“The most ‘important’ beings will decree to all the other beings that in all their appointed establishments, such as what are called ‘churches,’ ‘chapels,’ ‘synagogues,’ ‘townhalls,’ and so on, special officials shall on special occasions with appointed ceremonies wish for you in thought something like the following:"
    },
    {
      "anchor": "11.97",
      "chapter": 11,
      "page_start": 97,
      "page_end": 97,
      "text": "“That you should lose your horns, or that your hair should turn prematurely gray, or that the food in your stomach should be turned into coffin nails, or that your future wife’s tongue should be three times its size, or that whenever you take a bite of your pet pie it should be turned into ‘soap,’ and so on and so forth in the same strain."
    },
    {
      "anchor": "11.97",
      "chapter": 11,
      "page_start": 97,
      "page_end": 97,
      "text": "“Do you now understand to what dangers you exposed yourself when you called these remote three-brained freaks ‘slugs’?”"
    },
    {
      "anchor": "11.97",
      "chapter": 11,
      "page_start": 97,
      "page_end": 97,
      "text": "Having finished thus, Beelzebub looked with a smile on his favorite."
    }
  ],
  "source": "Beelzebubs_Tales.pdf",
  "source_sha256": "07a485ba109a1caf664083020ede051c6894099af7276a29bc8e9ada56d3d8bc"
}