{
  "id": 6,
  "canonical_id": "beelzebub/ch06",
  "urn": "urn:beelzebub:ch06",
  "title": "Perpetual Motion",
  "title_raw": "PERPETUAL MOTION",
  "title_slug": "perpetual-motion",
  "number": 6,
  "page_start": 73,
  "page_end": 75,
  "paragraphs": [
    {
      "anchor": "6.73",
      "chapter": 6,
      "page_start": 73,
      "page_end": 73,
      "text": "“ W ait! Wait!” Beelzebub interrupted the captain. “This—what you have just told us—must surely be just that short-lived idea which the strange three-brained beings breeding on the planet Earth called ‘perpetual motion’ and on account of which at one period a great many of them there went quite, as they themselves say, ‘mad,’ and many even perished entirely."
    },
    {
      "anchor": "6.73",
      "chapter": 6,
      "page_start": 73,
      "page_end": 73,
      "text": "“It once happened there on that ill-fated planet that somebody in some way or another got into his head the, as they say, ‘crazy notion’ that he could make a ‘mechanism’ that would run forever without requiring any material from outside."
    },
    {
      "anchor": "6.73",
      "chapter": 6,
      "page_start": 73,
      "page_end": 73,
      "text": "“This notion so took everybody’s fancy that most of the queer fellows of that peculiar planet began thinking about it and trying to realize this miracle in practice. “How many of them paid for this short-lived idea with all the material and spiritual welfare which they had previously with great difficulty acquired!"
    },
    {
      "anchor": "6.73",
      "chapter": 6,
      "page_start": 73,
      "page_end": 73,
      "text": "“For one reason or another they were all quite determined to invent what in their opinion was a ‘simple matter.’"
    },
    {
      "anchor": "6.73",
      "chapter": 6,
      "page_start": 73,
      "page_end": 73,
      "text": "“External circumstances permitting, many took up the invention of this ‘perpetual motion’ without any inner data for such work; some from reliance upon their ‘knowledge,’ others upon ‘luck,’ but most of them just from their already complete psychopathy."
    },
    {
      "anchor": "6.73",
      "chapter": 6,
      "page_start": 73,
      "page_end": 73,
      "text": "“In short, the invention of ‘perpetual motion’ was, as they say, ‘the rage,’ and every crank felt obliged to be interested in this question."
    },
    {
      "anchor": "6.73-4",
      "chapter": 6,
      "page_start": 73,
      "page_end": 74,
      "text": "“I was once in one of the towns there where models of every kind and innumerable ‘descriptions’ of proposed ‘mechanisms’ for this ‘perpetual motion’ were assembled."
    },
    {
      "anchor": "6.74",
      "chapter": 6,
      "page_start": 74,
      "page_end": 74,
      "text": "“What wasn’t there? What ‘ingenious’ and complicated machines did I not see? In any single one of these mechanisms I saw there, there must have been more ideas and ‘wiseacrings’ than in all the laws of World-creation and World-existence."
    },
    {
      "anchor": "6.74",
      "chapter": 6,
      "page_start": 74,
      "page_end": 74,
      "text": "“I noted at the time that in these innumerable models and descriptions of proposed mechanisms, the idea of using what is called the ‘force of weight’ predominated. And the idea of employing the ‘force of weight’ they explained thus: a very complicated mechanism was to lift ‘some’ weight and this latter was then to fall and by its fall set the whole mechanism in motion, which motion would again lift the weight, and so on, and so on."
    },
    {
      "anchor": "6.74",
      "chapter": 6,
      "page_start": 74,
      "page_end": 74,
      "text": "“The result of it all was that thousands were shut up in ‘lunatic asylums,’ thousands more, having made this idea their dream, either began to fail altogether to fulfill even those being-duties of theirs which had somehow or other in the course of many years been established there, or to fulfill them in such a way as ‘couldn’t be worse.’"
    },
    {
      "anchor": "6.74",
      "chapter": 6,
      "page_start": 74,
      "page_end": 74,
      "text": "“I don’t know how it would all have ended if some quite demented being there, with one foot already in the grave, such a one as they themselves call an ‘old dotard,’ and who had previously somehow acquired a certain authority, had not proved by ‘calculations’ known only to himself that it was absolutely impossible to invent ‘perpetual motion.’"
    },
    {
      "anchor": "6.74",
      "chapter": 6,
      "page_start": 74,
      "page_end": 74,
      "text": "“Now, after your explanation, I can well understand how the cylinder of the system of Archangel Hariton works. It is the very thing of which these unfortunates there dreamed."
    },
    {
      "anchor": "6.74",
      "chapter": 6,
      "page_start": 74,
      "page_end": 74,
      "text": "“Indeed, of the ‘cylinder’ of the system of the Archangel Hariton it can safely be said that, with atmosphere alone given, it will work perpetually without needing the expenditure of any outside materials."
    },
    {
      "anchor": "6.74-5",
      "chapter": 6,
      "page_start": 74,
      "page_end": 75,
      "text": "“And since the world without planets and hence without atmospheres cannot exist, then it follows that as long as the world exists and, in consequence, atmospheres, the cylinder-barrels invented by the great Archangel Hariton will always work."
    },
    {
      "anchor": "6.75",
      "chapter": 6,
      "page_start": 75,
      "page_end": 75,
      "text": "“Now just one question occurs to me—about the material from which this cylinder-barrel is made. “I wish very much, my dear Captain, that you would roughly tell me what materials it is made of and how long they can last,” requested Beelzebub."
    },
    {
      "anchor": "6.75",
      "chapter": 6,
      "page_start": 75,
      "page_end": 75,
      "text": "To this question of Beelzebub’s the captain replied as follows:"
    },
    {
      "anchor": "6.75",
      "chapter": 6,
      "page_start": 75,
      "page_end": 75,
      "text": "“Although the cylinder-barrel does not last forever, it can certainly last a very long time."
    },
    {
      "anchor": "6.75",
      "chapter": 6,
      "page_start": 75,
      "page_end": 75,
      "text": "“Its chief part is made of ‘amber’ with ‘platinum’ hoops, and the interior panels of the walls are made of ‘anthracite,’ ‘copper,’ and ‘ivory,’ and a very strong ‘mastic’ unaffectable either by (1) ‘paischakir’ or by (2) ‘tainolair’ or by (3) ‘saliakooriapa’1 or even by the radiations of cosmic concentrations."
    },
    {
      "anchor": "6.75",
      "chapter": 6,
      "page_start": 75,
      "page_end": 75,
      "text": "“But the other parts,” the captain continued, “both the exterior ‘levers’ and the ‘cogwheels,’ must certainly be renewed from time to time, for though they are made of the strongest metal, yet long use will wear them out."
    },
    {
      "anchor": "6.75",
      "chapter": 6,
      "page_start": 75,
      "page_end": 75,
      "text": "“And as for the body of the ship itself, its long existence can certainly not be guaranteed.”"
    },
    {
      "anchor": "6.75",
      "chapter": 6,
      "page_start": 75,
      "page_end": 75,
      "text": "The captain intended to say still more, but at that moment a sound like the vibrations of a long minor chord of a far-off orchestra of wind instruments resounded through the ship."
    },
    {
      "anchor": "6.75",
      "chapter": 6,
      "page_start": 75,
      "page_end": 75,
      "text": "With an apology the captain rose to leave, explaining as he did so that he must be needed on very important business, since everybody knew that he was with his Right Reverence and would not venture to trouble the ears of his Right Reverence for anything trifling."
    }
  ],
  "source": "Beelzebubs_Tales.pdf",
  "source_sha256": "07a485ba109a1caf664083020ede051c6894099af7276a29bc8e9ada56d3d8bc"
}